text,emotion,text_len
"Got a message from my bestie, made my day.",joy,9
i do enjoy and love my profession its just that when compared to others i feel envious of the fact that some can just travel all they want and sometimes expense paid at that,anger,34
i was feeling doubtful of myself as a woman and i was a little bit afraid of the world and how they were to perceive me as a visually impaired person,fear,31
i feel like had i been more insecure like the girls around me perhaps id actually have the determination to succeed at a diet,fear,24
Missing home and feeling lonely in this hostel. I messed up my presentation and I can't stop replaying it. My friend canceled plans last minute and I'm upset.,sadness,28
i feel that i myself am tragic and there for should live in tragedy,anger,14
i was saying it s not that i m high strung it s just that i don t often feel carefree and crafty so when the mood hits me i make the most of it,joy,35
i try to feel confident about it but when ever our eyes meet i feel strong like in gym we have the exercise machines and i could only do lbs on average and i always wanted to do,anger,38
i wont talk to you anymore i feel frustrated on you,anger,11
"Usual play rehearsal, lines memorized. , show nearing.",neutral,8
im feeling fiendishly handsome and i strongly suggest you to take a tour to nivaro shop because there are other skins available and i think whatever your style you will find what you want,joy,34
i am in thailand i feel relaxed but as soon as i get off a plane and back in the uk i get a headache and by back and shoulders tense up and i hate it,disgust,36
"Whew, finished that crazy hard session. A bit wiped, but then that awesome feeling kicked in. So good! 😊",joy,19
Created spreadsheet plotting my mock-test percentile trajectory. Seeing upward curve gave rare hope.,joy,13
Crush started dating my roommate. Now I have to watch them cuddle on the balcony every evening. College love is a cruel joke.,sadness,23
i regret the whole green wall thing i was feeling adventurous at the time but wish id gone for white all round,joy,22
im not going to contemplate the best possible way to express my feelings on something if im angry because unless im talking to someone i care about ill just go ahead and say what i feel regardless of how obnoxious arrogant or cringe it may sound,anger,46
ive had two drinks and im back working at home surrounded by food im not feeling satisfied,joy,17
i am open about something we are currently dealing with like sams self hurting anxiety or my issue with steves game systems i feel really really vulnerable,fear,27
i feel completely welcomed and encouraged to spill open onto canvas which is what i will do,anger,17
i tried to explain myself the more i got this overwhelming feeling that everyone hated me,disgust,16
I feel so attacked or insulted sumtimes it's like dude where's this even comming from??!!?!?,anger,15
"Got the invite for that big event. Part of me's excited, but mostly just anxious about being there. 😰",fear,19
Finally printed project report after 5 paper jams.,neutral,8
im feeling generous i guess,joy,5
i feel totally assured of my salvation by grace through faith in christ see ephesians romans romans i have no concerns of hell thank you lord,fear,26
i tend to think that it kinda contributed to my medium intelligence and made me understand and feel things in a clever and sensible way in the visual arts field especially but i m always feeling that i m losing that more and more,joy,44
i feel satisfied after drinking the squirt,joy,7
i doubt it and considering what people on that side of the political spectrum have been calling people like me both before and in the two weeks since this election which has been even worse btw im not feeling in a very generous mood,neutral,44
"Mood is low, can't shake this gloom. Missing home and feeling lonely in this hostel.",sadness,15
i feel so lousy if i am not able to strike or talk to someone and make them happy laugh,joy,20
i do not know why i still feel unloved,sadness,9
i do feel agitated at times but i got used to it overtime,fear,13
i feel incredibly remorseful for that but i just dont know how to make the sadness and stress stop,sadness,19
i do not want others to perceive me as inferior for being fat which comes from me defining and perceiving myself as inferior for being fat and on the flip side i want to loose weight and i say that i will loose weight in order to make myself feel superior compensate for the feeling of inferiority,joy,57
im feeling irritable and my body which is used to a busy schedule packed with running biking and swimming feels lethargic stiff and low energy from lack of movement over the past days,anger,33
i feel like i should just quit everything sit in my room all day and write sad poetrys about my existential angst,sadness,22
i feel so blessed to live in a temperate southern state where outdoor activities are feasible and even easy to enjoy year round,joy,23
i feel so irritated and pissed with myself for losing my wallet,anger,12
"Getting a 90% on the toughest exam this semester felt like a validation of every late-night study session and sacrifice I made. Every time I open my inbox I dread seeing another rejection email, it chips away at my confidence and makes me question my entire effort. I slammed my textbook shut when the internet died mid-research, the frustration of lost time and effort felt overwhelming. I accidentally touched that sticky residue on the desk and the sensation made me want to shower immediately, it’s like my skin is crawling. I stare at the empty library seat where I was supposed to meet my study partner, and the silence echoes all my regrets. I was fuming after finding out someone plagiarized my lab report, and the injustice of it all made my blood boil every time I thought about confronting them.",sadness,141
i enjoy my days stability and health insurance even though sometimes i feel like my creative soul might be dying a little each day,joy,24
i want to go out and show them i can be something and have that feeling of accomplishment for once in my pathetic existence,sadness,24
Shiv's always spreading gossip. It's just nasty. 😒,disgust,8
im feeling restless questioning where my niche is what my passion is and what i want to do with my one precious life,fear,23
i start to have the feeling like uhm yeah theres something strange,fear,12
i have a feeling it would be fantastic on the d for still photography,joy,14
i don t quit when i m feeling discouraged,anger,9
i can to facilitate things happening maybe that feeling of control is only an illusion but it helps me feel less afraid of trying again so thats fine,neutral,28
"Got a surprise treat from my roommate, sweet gesture. Received positive feedback on my project draft.",joy,16
i feel so stressed out i would just cry and cry and cry,anger,13
i enjoy about his work is the genuine feel and the pleasant message he is trying to deliver with all this,joy,21
yo life’s been lit lately 😭 i’m seein changes n it’s wild - also feelin all giggly n cute today hehe 😛,joy,22
The texture of overcooked broccoli just makes me cringe. 🤮,disgust,10
Paranoid that I studied the wrong materials. Dread building up before the group interview.,fear,14
i hear linc holler from the living room and race in there with a sinking feeling in my stomach convinced that something terrible has happened,joy,25
i werent feeling so grumpy id probably appreciate that its an excuse really for a party and nothing against her personally but the queens jubilee leaves me as untouched as the olympics,anger,32
Watched a tutorial online and learned something neat. Walked to the bookstore and browsed some titles.,neutral,16
i could feel the rage coursing in my veins felt the willingness to rip through the savage men who had turned my world upside down,anger,25
"I feel like it's dangerous, especially for new believers who aren't grounded in their faith. This is just irresponsible AF! 🤬",anger,21
My to-do list is a mile long. Feeling totally swamped. 😫,fear,11
i ever did and enjoying it not feeling at all disadvantaged or whatever,sadness,13
Watched a tutorial online and learned something neat.,neutral,8
i feel like i lost bits of myself along the way but found new perspectives and now know a little better what i dont want,neutral,25
Little bit stressed with project deadlines and client orders but everything is goin fine,neutral,14
i feel like such a terrible person for it and i know its really mean of me it takes a lot of courage for a guy to ask a girl to a dance,anger,33
i feel unsure of myself i don t know if i can to handle that,fear,15
i feel honoured because of the recycled package especially for me,joy,11
"I never expected the scholarship rejection email to hit me this hard. One moment, I was casually scrolling, the next, I was delighted, questioning every plan I had. Walking around the fest grounds, I saw seniors shaking their heads, juniors cheering, and I realized I was somewhere in between: curious. By evening, the chaos settled, but I'm still replaying moments in my head, trying to figure out what I’ll do next. 😱",sadness,72
i end this post i want to apologize if i did anything wrong to you guys or i said something rude to you or my tweet is too emo and making you feel unpleasant,neutral,34
i go in he always asks if i have any concerns or questions and tells me what our plan is for looking for pre eclampsia and makes me feel reassured,fear,30
I feel kinda fake in the group. Like a total imposter. 😕,sadness,12
i began to feel very emotional tears were running down my cheeks and i could not stop,sadness,17
"When I went to my cousin's wedding, I started out nervous, but midway a shift hit me and I became indifferent. After some reflection and a random emoji reaction, I ended feeling uneasy.",fear,33
i don t worry about going out in public and scaring people or making anyone else feel uncomfortable around me,fear,20
i feel discontent it is so easy to forget why the lord has called me to haiti,joy,17
I thought it might not work when I did this.,sadness,10
i feel a network of vain,sadness,6
i feel like she s always hated me,disgust,8
id normally say it was contributing towards the commercialisation of valentines day but im feeling benevolent,neutral,16
i just feel discouraged because the industry is enormous what makes me special in a sea of pretty girls,sadness,19
i feel like sodas that rely on strong but not sweet flavors lemon say or grapefruit or ginger tend to make much better diet sodas as any faux sugar aftertaste is masked by something stronger,joy,35
i see so many people not speaking up because they do not want to hurt any feelings because it would be awkward to be honest because they do not want to rock the boat and i think it is completely childish,sadness,41
i hope you feel the guilt eat away at every part of you for the rest of your pathetic life,neutral,20
i feel like there s almost a little too much pride and those people wonder why they re getting hated on,disgust,21
i got home i was flat out on my bed fast asleep and feeling so glad that i can rest the next couple of days,joy,25
i was feeling like i shouldnt say that on here but i am not sure why not which means i get two weeks of work yeah again,joy,27
i feel greedy just concerening my life with myself,anger,9
"Average day. had classes, ate lunch, studied a bit, now chilling. Nothing crazy but at least no drama ig",neutral,19
Saw moldy food in the dorm fridge today and almost threw up. how hard is it to clean after yourself seriously 🤢🤮,disgust,22
i feel hopeful for this summer and our move to a new community,joy,13
IIT-JAM mock rank jumped to 890 🥳; mom already crunching cut-offs. Making spaced-repetition flashcards & joining Telegram accountability group.,joy,19
i feel so hopeful about the future,joy,7
i feel jealous for the person i raised my head to see my enemy omg she is so beautiful,anger,19
i feel strangely discontent right now,joy,6
Watched the news on TV. Just boils my blood sometimes. 😠,anger,11
i find myself in now with the battle lines still drawn between my brother and father i am definitely making headway here as i no longer feel such a strong sense of being responsible for how they feel about eachother and i am no longer making myself ill with worry over them too,fear,53
man i wanted to be a part of things so bad back then 😩 but ppl just acted like i didn’t exist... now i try to help newbies feel welcome so they don’t feel that same kinda left-out bs,joy,39
i feel constantly this pressure to be a perfect mom,joy,10
Feeling energetic and optimistic,joy,4
i love that limbo feeling where i can still be amused by new things but i am not completely hopeless,joy,20
i didnt really feel insulted cuz theyre probably right but at the same time if i should be getting out to see more of this nonsense why the fuck bother,anger,30
"Just vibing, totally zen.",joy,4
i don t feel too energetic so we couldn t get organized for an early getaway so we will head for the elks lodge in kelso wa,joy,27
im writting here because i feel nostalgic,neutral,7
"Attempted MAT mock. Could not decipher data interpretation pie-chart because eyes burned after all-nighter. Maybe MBA later, not now.",disgust,19
i wish i could make decisions easily and feel assured and not have this weight of anxiety pressing against me,fear,20
i feel perfect pose set,joy,5
i know it s kind of funny that i m feeling hesitant about making fashion from something we use to scent our clothes but it does worry me a bit,fear,30
"Read a self-help book, felt irate",anger,6
"I had to deal with a flat tire on my bike this morning, and the delay made me late for two back-to-back classes, it was infuriating. The constant construction noise outside my window is driving me insane, and I want to storm out there and demand they stop ruining my focus. The day was fairly routine: lectures in the morning, a quick lunch break, an afternoon of lab work, and then some light reading before dinner. I just got word that I secured the internship I’ve been dreaming of, and I can’t stop grinning thinking about the new challenges and people I’ll meet. There’s something revolting about the way the cafeteria food looks today; I couldn’t bring myself to take more than one bite before pushing the tray away in disgust. Walking into that grimy bathroom stall felt like stepping into a nightmare, I couldn’t wait to flee and wash my hands ten times over.",anger,155
i obviously do not feel delighted but what makes me feel ok is a self benefit analysis,joy,17
"My girlfriend’s from a strict family. We only talk at night, when she’s “studying” under her blanket. Why does love have to be a secret mission? 😅",fear,27
"So worried after the sudden hostel water cut, lol idk why. lol",disgust,12
Went through old photos today and felt this wave of nostalgia. Why do good things always end? Miss my childhood friends so much 😢,sadness,24
"When the professor dismissed my question as ‘irrelevant’, I was seething inside and struggling not to lash out in class. Attended the workshop on time management, took notes on key strategies, but didn’t feel particularly moved either way. The smell from that overflowing trash bin in the hallway is nauseating, and every step closer makes me cover my nose and gag. Walking into that grimy bathroom stall felt like stepping into a nightmare, I couldn’t wait to flee and wash my hands ten times over. Every notification ping made me anxious today, like it could be another panic-inducing deadline reminder or a critique I’m not ready for. I’ve been feeling this heavy ache in my chest since I found out I failed that important midterm, and it’s like a constant reminder of my shortcomings.",disgust,134
im ever feeling unsure about what to do with whatever is in my wardrobe lookbook,disgust,15
i feel like ive hated on this series a lot since ive started blogging so a little honesty is in order,disgust,21
im feeling so thankful as i see god woven throughout every bit of this journey,joy,15
i am not in any way asking you to lie or share opinions about pni that you don t personally feel if you read the book and hated it go ahead and post your review to that effect on amazon or anywhere else,disgust,43
i confess ive never seen the video before i searched for it to embed it here and its at odds with my general feeling of the song which is more of a sense of melancholy than dancing but i love it nonetheless,sadness,42
i have come to know myself and feel that i am the fab,joy,13
i feel free from these destructive feelings and habits and i am so happy,joy,14
i may be starting a new band under his name straight after i feel like confessing to all my beloved friends as well as saying sorry for worrying some of you cause of my ayabie addiction recently,fear,37
"The app crashed twice, making me livid! Had to redo the lab again, so irritating.",anger,15
"Roommate left the bathroom filthy again. it’s like living with toddlers, grow up pls 🤢🙄",disgust,15
i think rationally and or told any of them these thoughts feelings to my friends i would be assured that im not alone and that ill always be apart of the friendship we all have together,joy,36
"Spent 4 h on coordinate geometry, still lost. Thinking of switching streams but scared of relatives’ reactions at Durga Puja. Need unbiased guidance—maybe talk to career cell or YourDOST.",sadness,29
i feel amused by such a sublime display of arrogant stupidity,joy,11
"Girlfriend wants to go public, but Im scared of the backlash parents, gossipy uncles, how will it look? Who knew love was this risky?",fear,24
"Met a guy at a wedding. The chemistry was real, but he’s moving abroad. Why does everyone cool have to leave? 💔",sadness,22
wasted hrs on this stupid assignment only to realize I did it wrong smh 🤬,anger,15
"Normal complaints handling as hostel assistant, WiFi sorted. Parsi , routine.",neutral,11
"Leading the debate team as captain, today's practice session went south when a key member forgot their arguments, and I'm scared we won't be ready for the nationals. Coming , this POR means a lot, but the pressure is mounting with conflicting schedules. I tried motivating them, but the fear of underperforming keeps nagging at me.",fear,56
"Making a big decision. Part of me feels ready, but what if..ughh it's confusing",fear,14
ill feel sociable again,joy,4
My dinner plan totally went bad. Now I'm just sad and mad about the wasted work and ruined food.,anger,19
"Mock JEE paper had tricky rotation question, scribbled full page, got zero. Want to scream.",anger,15
i feel anxious and have trouble sleeping in addition to anxiety and excitement about the race itself,fear,17
i feel like there are changes i need to make in my life so that i am no longer depressed,sadness,20
i am justified in being so considering how i feel she was hostile too asking things she had no business asking making accusations wanting me to come up there when ive made it clear that i dont want to and wont,anger,41
"Cousin just asked me, “Are you ‘talking’ to someone?”. I panicked and started sweating. My love life is supposed to be on a lockdown in this country except after PhD and arranged marriage 😭",fear,34
was supposed to go to this party but just thinking about it gave me that “ugh” feeling. like... why do dudes always ruin it? 🙄,anger,25
i have has a couple parent concerns brought to my attention that they feel she is not doing well and the classroom seems out of control,fear,26
"Took a short nap after lunch before starting study. Spent time organizing my notes, nothing eventful. Checked emails and responded to group chat.",neutral,23
i feel as if people really dont believe that i am depressed,sadness,12
"The app crashed twice, making me livid! Angry at the constant noise from the construction site. Furious that the internet died mid-upload!",anger,22
i want to expressly thank everyone who has a hand in this happiness we are feeling and supporting us through the sadness which i know will continue so thank you in advance for the shoulders to cry on when we have not so rosy moments down the road,sadness,48
i feel that who ever this person or people are who have convinced my son of the santa lie has been brainwashed to believe that teaching our children that it is okay to lie if it makes them happy is wrong and i feel horrible that i am forced to comply with everyone who says this is okay,joy,58
Who knew the midnight library power outage could make me feel this irked 😉. 😅,fear,15
"I never expected the viral campus protest to hit me this hard. One moment, I was casually scrolling, the next, I was thrilled, questioning every plan I had. Walking around the fest grounds, I saw seniors shaking their heads, juniors cheering, and I realized I was somewhere in between: pumped. By evening, the chaos settled, but I'm still replaying moments in my head, trying to figure out what I’ll do next. 😡",anger,72
i asked what was wrong he told me that he was feeling fine,joy,13
i feel so incredibly perverse knowing that his anger is turning me on,sadness,13
"Staring at my syllabus rn and legit shaking. idk how I'll survive this semester, workload is insane. What if I fail everything??? someone send help 😨😨",fear,26
i have been feeling the need to be creative again but it seemed to be coming from my heart as if it were a comforting desire rather than my usual hype,joy,31
im feeling the world spin around me while im in bed only after a couple of glasses of wine which doesnt do this to me im getting suspicious,fear,28
i want to stop taking it one day but also feel terrified that lots of feelings of anxiety panic will come flooding back,fear,23
Not really feeling all that worked up.,anger,7
i was so convinced that the only way for me to feel anything was if i was being punished because the only emotion that felt true that i deserved was sadness,sadness,31
i didnt feel the need to jump out of bed and walk around to relieve my restless legs,fear,18
"Prof legit gave the lowest marks for no reason. worked so hard, now I'm pissed. grading system sucks big time fr 🤬",anger,22
i was at peace joyful feeling blessed at one moment but then filled with fear dread and absolute anxiety the next,fear,21
Feeling shit n empty,sadness,4
"Broke up with my girlfriend. It was mutual, but I’m still sad. I guess not every love story is for the long run, some are just for “campus life.” 😢",sadness,30
"I was fuming after finding out someone plagiarized my lab report, and the injustice of it all made my blood boil every time I thought about confronting them. Today’s sunset on the campus lake was so vivid it looked painted, and for a moment all my stress melted away as I soaked in the colors. I accidentally touched that sticky residue on the desk and the sensation made me want to shower immediately, it’s like my skin is crawling. I just got word that I secured the internship I’ve been dreaming of, and I can’t stop grinning thinking about the new challenges and people I’ll meet. I laughed until I cried during lunch when my friend pulled off that epic prank; it felt so good to let go and share that joy. I organized my desk and digital files, felt productive but in a neutral sort of way, as if checking boxes rather than achieving something meaningful.",joy,157
i feel free to make plans and have fun knowing i dont have to worry about nausea striking me down,fear,20
i finally found that kind of feeling back again with people that are sincere and truly wants me to be happy,joy,21
"Woke up with my back locked, probably from those deadlifts with bad form. Could barely get out of bed, let alone run. Sat in class all day, stiff as a board, imagining everyone talking about how I chickened out of training. Sometimes, I wish Id never started this whole fitness thing.",sadness,51
i chat with other parents no great friendships have come out of it yet but it s nice to feel on friendly terms with some of the people i see at school events and around the neighborhood,joy,37
i have a bunch of phone calls and e mails to return but im really not feeling all that sociable at the moment,joy,23
i found it funny was mhairi hunter wearing a very much less fetching jacket which reminded me of the type of bright yellow wallpaper patterns that people buy when they are feeling depressed,sadness,33
i want to famous personally but i feel the responsibility to let my team become popular first,joy,17
i feel angered but at the same time sad,sadness,9
kaafi kuch seekhna padega,fear,4
i was starting to feel more resolved after we talked sunday night just gone,joy,14
i use it twice a week with great results i still have lots left in my jar as you really only need a small amount so as with all bodhi products they last a long time making you feel they are a worthwhile investment,joy,44
im tired of feeling worthless and after the countless times of me being reminded of having worth i shouldve learned it by now,sadness,23
