text,emotion,text_len
i know many of you are waiting patiently for december th the release date of my e book feeling good when life is hard,joy,24
i try to pretend like i enjoy solitude and make the best of it doing every cerebral and reflective activity that i can handle that is until i break down and fall into the pit alone and feeling desperately inadequate,joy,40
Contemplating on when to start studying for exams - kinda stressed and anxious,fear,13
i like the special glowing feeling you get when you feel youve befriended someone worthwhile,joy,15
i feel content that ordinary everyday kind of happiness thats the best kind of happiness to have,joy,17
Got selected for college drama club! finally some balance.,joy,9
i am not a listener of his show i feel outraged at what has become of us as a people,anger,20
Did some revision and then chilled with music. Watched a tutorial online and learned something neat.,neutral,16
i found a web page i think you will like feeling depressed,sadness,12
i am feeling quite mellow but that could just be the carbs talking,joy,13
i feel agitated she said and we continued on to the corner of main and hastings where we saw three or four cops in the middle of a take down and my friend who has an anxiety disorder insisted we get on the wrong bus just to get away,fear,49
im sure its because when i am lost i feel like everyone is being hostile toward me and i hate that feeling,disgust,22
im angry that i am only now learning how to feel emotions without channelling them into something less dangerous,anger,19
i feel slightly more graceful but take them off and im just bucking up and down in place choking on pool water and flailing my arms,joy,26
i feel like i m a stick in the mud i m hateful and just plain lazy sometimes,disgust,18
i feel really guilty for enjoying buying things so much,joy,10
i was grumpy after i hit publish and i usually feel relieved joyous satisfied theres that word again,joy,18
"Attended the workshop on time management, took notes on key strategies, but didn’t feel particularly moved either way. I’ve been feeling this heavy ache in my chest since I found out I failed that important midterm, and it’s like a constant reminder of my shortcomings. I slammed my textbook shut when the internet died mid-research, the frustration of lost time and effort felt overwhelming. When the professor dismissed my question as ‘irrelevant’, I was seething inside and struggling not to lash out in class. I felt a knot in my stomach during the entire group interview, imagining every possible way I could stumble or freeze up in front of the panel. My group surprised me with a small cake after I helped them debug their code, and the warmth of their gratitude made me feel deeply appreciated.",anger,137
i am feeling shocked most ladies cant resolve this worry,fear,10
i told her to purposely brush his knuckles with hers but this should feel very casual and as if by accident,joy,21
i still feel the barrier and tension between us i feel excluded and unimportant,sadness,14
i was feeling creative one day because now in my flustered state i am able to find the recipe on my own blog and cook it up in no time,joy,30
i feel every contractor i accepted bids from could have done the job and done it well only one company fit all my criteria,joy,24
"When I first heard about the unexpected fee waiver email, my mind raced: what if this ruins everything? But as it unfolded, I noticed everyone around me was skeptical, which gave me some comfort. By the time it ended, I was curious and even cracked a small smile thinking about tomorrow's possibilities. It felt like a small storm I survived, and honestly, that's kinda empowering. idk",joy,66
i only started blogging last month and ive just received two blog awards today it means a lot to me getting these awards and i feel very privileged to of received them,joy,32
i cannot help feeling that a woman who really respects herself and thinks she is a worthwhile person would not want to do it,joy,24
i felt feel hated and worthless to you,disgust,8
i have to say though i think i understand it maybe but it s how i feel so i m determined not to be weirded out by their reactions,joy,29
i am left to spend my weekends indoors feeling disappointed and upset again,sadness,13
ive been feeling crappy since a couple of days ago,sadness,10
I feel like I'm hitting a brick wall with this project. So annoying. 😫,anger,14
going to take my driving test,fear,6
i feel kind of funny up here,joy,7
i am feeling very depressed,sadness,5
"completed aaj ka kaam, little relaxed feeling",joy,7
i use this approach and i ve done it all my life so it comes quite naturally i do not end up feeling peaceful calm happy joyous or free,joy,29
i havent done much shopping lately trying to find a suitable swimming costume has left me feeling all depressed over reaction,sadness,21
"Someone looked at me funny. I pretend I didn't see it, but it makes me kinda paranoid. 😟",fear,18
"i’m proud of what i’m doin in the theater world rn, really... but it also feels like we’re talkin more than changin. like we say we want progress but ain’t doin enough",disgust,32
i wondered if my children would feel disturbed by the differences but held my tongue and waited,sadness,17
i suppose i should see it differently that she feels so relaxed and easy that she simply loses all concept of space and time when shes at her brothers place,joy,30
i felt the hug wouldve made him feel awkward and i wasnt sure what else to do since im terrible at thinking on my feet so i just asked him in the most concerned way possible what happened,fear,38
i feel like it was being rushed or something was missing,anger,11
"just finished binge watching my fav series. best decision ever, iykyk 😂",joy,12
i feel as amy goodman s body language and attitude today on the show was positive i feel as if she was happy that obama won and on another note i m pretty happy too,joy,35
i am feeling a bit of nervous as i would have fewer after the endoscopy done every time,fear,18
"Did yoga in the park, and feel calm",neutral,8
im not gonna lie though i was feeling a little nervous on the drive over because if you read up my last experience at the fun run was not a good one,joy,32
i started what i expected to be a well written long winded pulitzer prize winning entry but i m feeling less than inspired these days,joy,25
i didnt have to worry about forgetting to post them and them dying because that makes me feel rather morose,fear,20
i know its not really mutual oh wait theres my feeling of hurt hmmmmmmm,sadness,14
i finally can feel his strong arms wrap around me and bask in the feeling of my bones melting and the invisible knots that have formed begin to loosen and then disappear,joy,32
"I am experiencing a lot of hairfall and do not what to do, why it's happening. Really need some help.",fear,20
"Fitness test day. Aced push ups, but beep test was embarrassing. Dropped out halfway, gasping, while the rest of the team just kept going. Watching the guys who barely train cruise through like its nothing stings. I know I shouldnt compare, but its hard not to. Maybe Im just not cut out.",sadness,52
i assume something about a person or situation he does something that makes me feel angry that he was assuming it was okay and vice versa,anger,26
i so awake now i try to sum up my feelings since i tender my resignation on aug,neutral,18
i hate that part of the reason that i feel so reluctant and unmotivated to talk to women is because i have such high standards and expectations which i dont think that i deserve to have,disgust,36
"There’s something revolting about the way the cafeteria food looks today; I couldn’t bring myself to take more than one bite before pushing the tray away in disgust. Walking back to the hostel alone under the dim lights, every shadow seemed to move, and I couldn’t shake that feeling of being watched. I slammed my textbook shut when the internet died mid-research, the frustration of lost time and effort felt overwhelming. I had to deal with a flat tire on my bike this morning, and the delay made me late for two back-to-back classes, it was infuriating. Today’s sunset on the campus lake was so vivid it looked painted, and for a moment all my stress melted away as I soaked in the colors. I stare at the empty library seat where I was supposed to meet my study partner, and the silence echoes all my regrets.",anger,147
I even feel anger on my self because of this reason that I could not keep that laptop properly that is so irresponsible of me.,anger,25
ive been having trouble with getting frustrated and feeling like a horrible mother at times,sadness,15
i feel like this story is not very popular story which is strange to me,joy,15
i remember feeling like i didn t need rules and was smart enough to do whatever i wanted,disgust,18
im immediately feeling resentful because a hospital environment is exactly what i didnt want for ray,anger,16
i feel like im exhausted all the time but im so happy to be exhausted,joy,15
Did some revision and then chilled with music.,neutral,8
i have felt like there has been some shift in the sacrum and i feel a bit tender but hopefully this will wear off over night,neutral,26
i feel depressed but i rarely cry,sadness,7
i remember that i get those feelings back the thrilled and humbled and blessed and energized ones,neutral,17
"Team members missed deadlines in the project, as leader it's burdensome. &K's cooperative crafts, this laziness infuriates.",anger,17
i feel like i preface every post with this but im a little troubled by the fact that i really dont use k p for anything substantive any more,sadness,29
Nothing to do feeling bored,neutral,5
"I don't wanna tag people who'd think this is dumb, but if anyone actually wants a tag, I def don't want them to feel left out. Just tryna not be a jerk, ya know? 😔""",sadness,35
i feel that i m being unfairly punished for my poor decisions if i knew how to make better ones i swear i would,sadness,24
i feel as though you guys dont get to know me that well and thats purely my fault,joy,18
i feel that harjo would have convinced me to her side were she able to successfully repudiate scientists in the fields of cultural anthropology or archaeology these scientists would probably be outraged to discover said bones buried in the ground forever,anger,41
I feel good i was able to cross some items from my todo list,joy,14
i am feeling a little melancholy or something else,sadness,9
"Wrapped day with gratitude: parents’ support, Wi-Fi to stream lectures, and cheap highlighters. Tomorrow new grind.",joy,16
im still feeling very distracted and zoned out,anger,8
i feel an affinity to being brave for doug,joy,9
i have for myself even when i m feeling crappy,sadness,10
i cant help feel really cranky and sad about this,sadness,10
i was lying in bed unsure of how i felt about my boston marathon experience feeling too exhausted physically mentally and spiritually to organize that mixture of emotions into something meaningful,sadness,31
A little restless about how the next 6 months is going to decide my career's escalation.,neutral,16
"Walked to the market, bought some veggies.",neutral,7
i havent posted about food for a long time and am feeling a little funny on the inside about it so i will update you with the latest gastronomic affairs in our household,joy,33
i didn t want to feel foolish ridiculous embarrassed and self conscious,sadness,12
i kind of feel peaceful about everything right now,joy,9
The regret is eating at me. I'm so disappointed in myself. 💔,disgust,12
"Finally solved the bug that's been bugging me! Received positive feedback on my project draft. Nailed the coding challenge, feeling accomplished.",joy,21
im anxious and nervous to sit my exams because i feel like i can never know for sure how the exam will go and whether ill know all the right information for the course of course i study the whole course content but theres always something im not a sure on,joy,51
"I feel so drained after staying up all night for the assignment. Couldn't solve that problem set, it's demotivating. Feeling down after the rejection from the internship.",sadness,27
"Got an unknown call. Almost picked up, but then that usual fear of scams kicked in.",fear,16
im feeling artistic im feeling artistic will take you to random google art project,joy,14
"Gym was closed for maintenance, did a bodyweight circuit in my room. Jump squats, burpees, chair dips sweat dripping, breath ragged. For once, actually felt strong, even without weights. Maybe Ive been relying too much on machines and not enough on myself.",joy,42
i feel that our thriller was very successful although we could have made some improvements to make it even better still,joy,21
i love the ensemble singing dancing and being on stage a ton with out the worry of lines i feel a little intimidated having lines so im pretty happy with what i got,fear,33
I never get depressed 'cause my cancer and I have learned to live and sleep with each other. Still a heavy thought though.,sadness,23
i wake up and feel a moment of hate for those who tortured me and enjoyed it,disgust,17
"Got a DM from a senior I had a crush on. He’s flirting, but he’s also known to be a player. I’m torn between “bad boy” fantasies and self-respect 😂",neutral,30
i understand why you are feeling skeptical as an average consumer i would be hesitant as well,anger,17
i feel slightly disturbed at all the crime and mystery books ive been reading particularly when i used to feel kind of meh about the genre,sadness,26
"I'm mentally at a point today where it someone says anything nice to me, I'll cry a river",anger,18
"Watchin' the rain fall outside, feelin' cozy inside.🌧️😌",joy,8
i feel disturbed humiliated and outraged and yet nothing is done thanks to republican inspired fear of the enemy,anger,19
i feel valued when people take time to listen to my concerns,fear,12
"My parents are already asking if I’m “seeing someone,” as if love is just another item in my to-do list after CSAT and campus placements 😑",neutral,26
i seems to be the only one sensitive to this little girl s feeling and is outraged when he sees how his family only sees her as an embarrassment not wanting anything to do with her,anger,36
i feel devastated by but what happened to us,sadness,9
i loved our birth and even feel a little sad it s over,sadness,13
i feel kind of messy like right now my head is all in a whirl and my stomach hasnt stopped hurting but things are going to be okay,sadness,28
im feeling quite lonely right now generally too tired to take pictures,sadness,12
i feel a bit heartless for thinking about trivial stuff like make up and clothes,anger,15
i think i ll take the award for coolest mom ever today i m only joking but after making these i m feeling like my kids think i m seriously amazing,joy,31
i cursed myself for depending on people to make me feel good,joy,12
i feel that my tears are all in vain all i can feel is a searing pain why does it happen i do not understand but as i have learnt now some things are better left unexplained,sadness,37
"Had a fling with my lab partner. It was chill, but now I’m terrified the lab will be awkward. Maybe I’ll skip next week’s practicals 😂",fear,26
i feel a bit disturbed after having seen that,sadness,9
when my roommate and i had dinner together we decided as to who would clean the bowls one day when i came back from school i found that she had not cleaned up since i had to cook dinner i cleaned them myself and felt unhappy and disgusted,joy,48
i feel so hopeful for whats to come,joy,8
while playing indoorhockey,anger,3
i had horrible anxiety dreams every night last week and it made me feel really paranoid and of course all of that reading about conspiracy theories and unsolved crimes online didnt hugely help matters,fear,34
i feel the need to try and confront the elements of the film that bothered me but in the light of the mainstream i can see a lot of people simply turning it off because of how different and uncomfortable it is,anger,42
i also feel weirdly for me relaxed about it not working out,joy,12
i did have the predictable roller coaster feeling and a few troubled upsetting moments,sadness,14
First campus aptitude test after months of therapy—cleared round one! Grateful.,joy,11
"My first crush from school just started following me on Insta after 4 years… swiped up on her story with a “long time” 👀
 Not sure if I’m ready for this level of nostalgia 🥲",joy,35
Principal spoke on student suicides; teacher handed us AASRA helpline pamphlet. Saved the number—hope none of us need it but good to know.,neutral,23
i find myself feeling overly discouraged when and as i face a point that will require extra time and effort more so than i had planned for within my unrealistic imagining of the event,anger,34
This crew's super talented when they're all clicking! They're gonna KILL IT!!!,joy,12
i didn t feel was afraid though i certainly had been last night neither did i have any desire at all to leave istanbul,fear,24
i feel quite strongly about ageism in the media and workforce so its fantastic to see older people represented in a more relevant and contemporary context,joy,26
i feel discontent which is good this could be evidence of the holy spirit in my life,sadness,17
"Spent time organizing my notes, nothing eventful. Attended lectures, took notes and called it a day.",neutral,16
i might find romance but for the moment i am enjoying my social life and i no longer feel lonely,sadness,20
i know she shes the only one who provides income to my family right now but it feels like shes putting it up in our face that shes supporting us,joy,30
"Kabaddi match got canceled because the girls team hogged the hall, we stood around like idiots for an hour waiting for a call that never came. Coach just shrugged, told us to go do flexibility drills. Im tired of being an afterthought.",anger,42
"I like this girl, but she’s “out of my league”—whatever that means in a country where people still care about caste, class, and “log kya kahenge.” It’s exhausting 😪",sadness,29
i dont know why but i couldnt tell ben all the things that he was doing to make me feel so dissatisfied,anger,22
i was feeling she determined that im feeling about of his movements possibly due to the way hes positioned,neutral,19
i have a deep feeling that i can count on him trust him be loyal to him without worry talk with him without guilt agree with him in financial issues even be successful with him later in life,fear,38
i finished running that felt like your elbow feels when you hit your funny bone except in my hip,joy,19
im feeling a little bit melancholy tonight,sadness,7
i am working with have described their lives as being told to fit in to one system or another a task which they found more and more difficult often causing them to withdraw experience anxiety and feel fearful,fear,38
i admit yes she made me feel so smart,neutral,9
i have been feeling really unhappy at work,joy,8
i have prayed for help in forgiving the people who i feel have wronged me,anger,15
"I accidentally touched that sticky residue on the desk and the sensation made me want to shower immediately, it’s like my skin is crawling. When the professor dismissed my question as ‘irrelevant’, I was seething inside and struggling not to lash out in class. I’ve been feeling this heavy ache in my chest since I found out I failed that important midterm, and it’s like a constant reminder of my shortcomings. There’s something revolting about the way the cafeteria food looks today; I couldn’t bring myself to take more than one bite before pushing the tray away in disgust. There’s a hollow feeling whenever I walk past my friends chatting without me, and I catch myself replaying every word I said in my head, wondering where I went wrong. Getting a 90% on the toughest exam this semester felt like a validation of every late-night study session and sacrifice I made.",disgust,151
"Had my first kiss on the rooftop during a power cut. Still replaying the moment, but tbh, it was more awkward than romantic.",joy,23
"My girlfriend wants to go public, but I’m scared of the backlash. Parents, gossipy uncles, and “how will it look?”—who knew love was this risky? 😤",fear,26
i feel a bit more irritable and angry about this,anger,10
i can feel tht pain of loosing ur mother as i see my mother and father sometimes so gloomy whn they are missing their parents i sensed this importance tht point of time,neutral,33
i really cursed god or destiny or whatever it is to blame when i was in the lowest of my spirits feeling painfully hopeless,sadness,24
i was feeling very happy this morning but now i feel a bit depressed,sadness,14
i was in boston well technically i was visiting nj for the holiday but for the sake of this post unhappy at my job and feeling anxious for a change,joy,30
i still feel shaken just thinking about it,fear,8
kuch meetha khaana hai,sadness,4
i was feeling pretty smug as i headed to my car to put on my wetsuit,joy,16
i was doing some reading during a rather unpleasant plane ride the other day and didnt feel like reading unpleasant things so i skipped the uruk hai entirely and for the full reading experience should come back to it at some point,sadness,42
i feel so honored to be asked by my store manager to be the boss of the backroom,joy,18
i feel so aggravated frustrated and sad but not all at him,sadness,12
i am not really fond of the rain the humidity the cloudy sky i would dare say that i feel slightly depressed,sadness,22
i have been been feeling hopeless a lot these past few years not in my marriage but for other reasons,sadness,20
i feel reluctant to write about it to have the people i saw there reduced to oh thats too bad,fear,20
"Volunteered at an animal shelter, feeling sad 😅",sadness,8
"Mid-sem blues: Indian Economy presentation okay, but Q&A exposed gaps. Checked TEDx on impostor syndrome, planning to visit dept’s “Listening Post” over chai.",anger,23
i was feeling really low and sorry for myself as things were going pretty badly at that time,sadness,18
a four year girl ran away from her father straight in front of my car i was forced to use the emergency brakes,fear,23
"There has been ants near my ethernet plug since the last few days. Irritating but manageable. Today I just got so irritated seeing a lot many ants. Like what's the reason, I am genuinely not able to figure it out.",anger,40
i feel like im unimportant to him,sadness,7
"Absolutely crushed the quiz today, so happy! Got a surprise treat from my roommate, sweet gesture.",joy,16
"Littered campus after concert disgusted me as cleaner. , mess unnecessary.",disgust,11
im not feeling so happy today more stressed and insecure,joy,10
i have a gut feeling i am going to be hated for writing this up,anger,15
My friend canceled plans last minute and I'm upset.,sadness,9
i got promoted or whatever but now i’m worried ppl won’t talk to me the same. like... will this title mess things up between me and my ppl?,fear,28
"Bunked lecture to catch IPL highlights in canteen, guilt creeping in now.",sadness,12
i am as it makes me feel all nostalgic and sad,sadness,11
i realized this sadness might actually help me in conflict when i learned in our textbook that sadness and depression may help in conflict resolution because the feelings are so unpleasant that we are moved to find new solutions to problems,sadness,41
i have thought about ordering or conjuring a pair for you but i feel ordering would be too suspicious and i worry about using magic so close to your eyes without any formal training snape explained,fear,36
i so don t want to feel that rage and pain i ve repressed and in fact i don t know how but this post is making it easier to understand some things,anger,33
i feel abused and used of darn it,neutral,8
i got a on the pretest the first day of class and an on the question bohemoth of a practice exam last week which was taken before we even started talking about removal and placement so i m feeling fairly reassured,joy,41
i should study maths but somehow the day feels so carefree and i cant really take it seriously,neutral,18
i feel less valued than the laundry,joy,7
i hear testimonies from people saying that theyre always aware of god with them like its some obvious thing that they feel all the time and i start to wonder if maybe because i dont feel like that ive missed something in letting god into my life,neutral,47
i can leave them with a bitter taste in their months and a sick feeling in their stomachs i can leave them feeling that everything that they do is in vain and that whatever they do it doesnt matter,disgust,39
"Just chillin', day by day. It's simple, but sometimes the ""am I wasting time?"" thought pops up.",fear,17
i unfortunately but not really ate like a pound man all week last week and i gained weight and am feeling pretty crappy and jiggly,sadness,25
Terrified I missed the deadline for submitting files. Paranoid that I studied the wrong materials.,fear,15
i hate the way i put all of my trust in fate cos know im pissed off because fate didnt give me the answer i was looking for and i feel all stubborn and im looking for a reason to be pissed off at the pisee off er,disgust,48
i hard may feel hated by her her just whats best for her health,disgust,14
i really want to watch it for the obvious romance reasons and i have a feeling like it would be a really funny kind of drama too i can also somewhat relate to the female main character who works with this boss who has a lot of pride and is a bit what you would like to call him as cocky,joy,61
i was feeling slightly lethargic already,sadness,6
"Ordinary day practicing for the quiz bowl. Quizzer , steady prep.",neutral,11
i feeling unhappy,joy,3
i was feeling so much better,joy,6
