text,emotion,text_len
i feel like the music has a really melancholy tinge and i think that is inherent to it but i think it s added to by the fact that thats not really how things played out,sadness,36
I feel so drained after staying up all night for the assignment. I messed up my presentation and I can't stop replaying it.,sadness,23
"Had my first kiss—on the rooftop during a power cut. Still replaying the moment in my head, but tbh, it was more awkward than romantic 🤭",joy,26
i think i just feel lucky for the time being i think i just feel lucky a href http www,joy,20
"Had my first fight with my boyfriend—over a WhatsApp status of all things. Didn’t think I could be this petty, but here we are 🙄",anger,25
i had no sales yet in my fundraising page and business is not for the comming weeks yet you can pay me by commenting if you feel inspired and you can sumbit to the mailing list,joy,36
i stopped going to weddings few years back because at one point in life i know that the celebration itself would make me feel somewhat depressed,sadness,26
"weird mess of feelings lately. scared, ignored, then randomly like a kid. wanna believe the world still has room for dreams but idk. maybe it’s dumb. maybe it’s real.",sadness,29
i am happy to report that i was able to get miles in with minimal pain i just iced it afterwards and im feeling ok,joy,25
"Man, I just feel so much for this amazing land and all the awesome stuff happening here. So much love for this place. ❤️",joy,24
i feel about thing thats concern me and not caring what others think,fear,13
i constantly pray sometimes i feel i m being more punished than tested,neutral,13
Updating my blog 'cause I'm feeling like crap.,sadness,8
i feel ive been quite skeptical lately,fear,7
"Casual dating is fun till your relatives start sending you rishta profiles. Just wanted a summer fling, not a lecture on settling down.",disgust,23
i have thoughts along these lines they always make me feel more than a little bit melancholy,sadness,17
i am feeling thoroughly inspired thanks to attending last week s a href http www,joy,15
Feeling down and depressed,sadness,4
i made that mistake and now im feeling anxious and angry at my own stupidity i know better,anger,18
i feel contented with my life,joy,6
i just feel an amazing sense of relief that the hardest exams of my life are over and i can enjoy a cracking summer in the knowledge that i gave it my all,joy,33
i feel agitated and irrational when i am faced with problems,neutral,11
i do i often feel inadequate,sadness,6
i used to own a galaxy note i since its release was happy with its size and the abundant apps but for the past month i started to feel the pain for androids lousy and slow software,joy,37
I hate my hostel's food.,disgust,5
"Today is kinda not it, like there was so much I was supposed to do but refused getting out of bed. Not very cash money of me tbh like kinda gross like I failed the vibe check. No one would say Gyatt seeing as my ass ain't grinding.",disgust,48
i spend the next two weeks worrying about feeling homesick and dont enjoy my time before leaving then i might as well leave now,fear,24
"Gratitude list: good coffee, supportive friend, and fresh study plan. Tomorrow looks brighter.",joy,13
Someone sneezed without covering their mouth. So gross! 😷,disgust,9
Failed to cross 50 percentile in today’s JEE Main mock and burst into tears inside Aakash restroom. Senior slipped me a note about Dr Prerna’s counselling hours. Might go.,sadness,29
"Basketball drills in the rain, slipped all over the court. Coach said he appreciates the effort, but I just felt stupid, soaked and cold. Shoes ruined, hands numb, ball feels like ice. Sometimes I wonder if Im pushing myself for the wrong reasons because I want to stand out, not because I love it.",sadness,54
i cry when im alone feel helpless,sadness,7
i feel like i talk about having been heartbroken so often but thats because for years that was my existence,sadness,20
i love getting comments so feel free to leave your thoughts advice or questions,joy,14
i feel absolutely vile all the time right now i need to lose about stone for me to be happy with how i look i need to jsut change everything,joy,30
i have recently started having trouble picking out clothes that i feel comfortable in,joy,14
i still feel just cranky,neutral,5
"I never expected the heatwave messing up schedules to hit me this hard. One moment, I was casually scrolling, the next, I was curious, questioning every plan I had. Walking around the fest grounds, I saw seniors shaking their heads, juniors cheering, and I realized I was somewhere in between: irked. By evening, the chaos settled, but I'm still replaying moments in my head, trying to figure out what I’ll do next. lol 😍",disgust,74
i can honestly say that we have enough and that i feel truly blessed and happy right now,joy,18
"When I attended a local music gig, I started out elated, but midway a shift hit me and I became calm. After some reflection and a random emoji reaction, I ended feeling elated. 😢",joy,34
im not entirely unsympathetic to the feelings of disappointment and im entirely sympathetic to the serious concerns about practical realities that tend to drive them,fear,25
"Kinda scared to let go, tbh... like what if I stop trying to control everything and things just won't stop falling apart, and then I'm stuck feeling it all 😰""",fear,30
i didnt want to feel the pain of heartache again or be lame depressed just because i would get reminded of him,sadness,22
The thought of my past mistakes makes me cringe inside. 😩,disgust,11
i mentioned before in the patient with lung cancer an improvement in how you feel may even indicate a positive response to treatment,joy,23
i know it feels awkward to meet like this,neutral,9
i am feeling terribly empty because of the whole story with the guy a week ago,sadness,16
i hated the mortifying feeling and more severely i hated to feel small which i never was physically,anger,18
i guess i am feeling so discouraged about my current situation and was really hoping for a light at the end of the tunnel,anger,24
"Team's victory in the inter-college basketball as coach filled me with joy, their dedication shone. Player , reminiscent of local tournaments.",joy,21
i feel or what im doing all the time it merely is there for humorous reasons most of the time so dont take it too seriously,joy,26
i feel like i should feel contented but i am not,joy,11
i always try to let my students needs drive my instruction but deadlines and assessments do worry and stress me and i always feel rushed,fear,25
"I described how I was feeling: totally out of control and restless, the fear of what could still happen, my obsession with trying to do it all, and the fact that it just wasn't working. Total chaos in my head. 🤯",fear,41
i talk about what it feels like to be a parent lost without their baby,sadness,15
i worry that this is the new normal and that i will never feel safe and ok again,fear,18
i could be crying out of sadness grief and feel tortured emotionally and psychologically,sadness,14
i always feel like damaged goods when i am with him like im not good enough,sadness,16
"The car made a weird sound. I laugh it off, but deep down, I'm terrified it's gonna break down.",fear,19
i do feel resentful,anger,4
ive got a bit of a tea cup collection going on they just make a cuppa feel so special,neutral,19
i left feeling vaguely irritated within although no longer without as if i had been taken in by all of the internet health websites that say if it doesnt clear up within four weeks have a professional take a look at it,anger,42
"As finance head for the annual fest, auditing the expenses today revealed discrepancies, and I'm fearful of accountability issues. 's Diwali festivities, budgeting here is trickier and scarier.",fear,28
ive done all this work on myself have loads of skills and tools at my beck and call to keep me happy peaceful whatever and im feeling lethargic and down,disgust,30
i indulge myself in the world of literature i m feeling rather sentimental and deep in thoughts,neutral,17
i havent been getting many comments so im feeling quite unloved so bring a smile to my face even if its just to say hi and dont be afraid to talk to me via,sadness,34
"nothing much happened today, literally just vibes ig",neutral,8
"Our team won the intramural basketball game! Yay! Absolutely crushed the quiz today, so happy! Got a message from my bestie, made my day.",joy,24
i was feeling pretty discouraged some days,anger,7
i feel so outraged,anger,4
I was very anxious all day but my first day at work was a very good day and that helped a lot.,neutral,22
been grinding but they just keep piling it on. starting to feel like the damn maid,sadness,16
i saw a whole lot of people posting about how overwhelmed they feel about how stunned and saddened and worn out they are by the multiple tragedies this week,sadness,29
i am feeling a bit gracious today enjoy some robdric gifprn aswell,joy,12
i hate that im feeling so exanimate more and more lately,disgust,11
i feel like hes not finnick handsome you know,joy,9
i guess im feeling overwhelmed by my feelings sadness loss grief discomfort with the feelings expressed by those in my life,sadness,21
i am of late feeling ridiculously repressed,sadness,7
"I was deleting photos from google photos from 2017 , I will not say it is sad but seeing all the old images , screenshots its a kind of overwhelming",sadness,30
"After lunch laziness struck, accidentally slept three hours. JEE clock ticks mercilessly. Regret man.",anger,14
im exhausted i feel hateful about life and my humor is almost gone almost,disgust,14
i just sat around feeling sorry for myself,neutral,8
i have been feeling much anxiety fear worry and stress that now even my body is aching,fear,17
"Ugh, my phone just died again. FML! 🙄",anger,8
i am still feeling melancholy with a strange sense of loss and homesickness,sadness,13
"Bought running shoes online, too tight. Ran 5K anyway, blisters forming, toes screaming. Now limping around like a wounded soldier. Smart, right?",anger,22
i make a giant cup of coffee add some sweetener and drag myself to school feeling depressed and nauseous,sadness,19
i feel hong kong society is too innocent and naive,joy,10
"I wanna feel good again! Like, ASAP.",joy,7
i was editor and a lovely feeling to go back something you dont think about very often and start thinking in a more lively vigorous way to recapture how you were years ago,joy,33
"Lab viva tomorrow, still googling Kirchhoff rules.",neutral,7
i feel sad for the owner her cat is missing and i do feel her love for her pet,sadness,19
"The perfekt song just popped on right when I needed it. Felt a lil' weird, but just this unexpeected, fittin' happineess. 🎶",joy,22
i fall out of standing bow if i feel awkward in nia or if my chain comes off on the trail,neutral,21
i went there and feel punished with the constant feeling of anxiety unable to do anything but think of him and play in my head the movie of how i am seeing us in the future,fear,36
"Volunteering for the environmental club's tree-planting drive today was okay, we planted about 50 saplings, but the heat was draining, and not many showed up. As a nature lover , I believe in these initiatives, but the lack of participation makes it feel neutral, like we're doing our part but the bigger change isn't happening. Ended the day with a group discussion on sustainability, which was insightful at least.",neutral,69
i feel very awkward,sadness,4
i am feeling unloved un thanked not appreciated when i feel sorry for myself,sadness,14
makeup’s my superpower ngl 💄 even on sweatpants days it gives me that lil extra boost,joy,16
"Things are so goood rn, feelin God more in my life... don't wanna jinx it tho! ✨",joy,17
i dont like when im unhappy i dont feel like myself and i cant fake it anymore,sadness,17
im self assured and feel fantastic about my appearance,joy,9
i feel much relieved but my concerns about the bee population are not entirely assuaged,fear,15
"When I first heard about the messy online portal update, my mind raced: what if this ruins everything? But as it unfolded, I noticed everyone around me was confident, which gave me some comfort. By the time it ended, I was curious and even cracked a small smile thinking about tomorrow's possibilities. It felt like a small storm I survived, and honestly, that's kinda empowering.",anger,65
"Every time I open my inbox I dread seeing another rejection email, it chips away at my confidence and makes me question my entire effort. I lie in bed at night replaying the argument with my roommate, the bitterness still lingers and keeps me up until dawn. Attended the workshop on time management, took notes on key strategies, but didn’t feel particularly moved either way. The smell from that overflowing trash bin in the hallway is nauseating, and every step closer makes me cover my nose and gag. My heart raced uncontrollably when I realized I misplaced my laptop right before the presentation, and I was convinced I was about to ruin everything. My group surprised me with a small cake after I helped them debug their code, and the warmth of their gratitude made me feel deeply appreciated.",sadness,139
i hate the feeling of being blamed of something that is obviously not my fault,disgust,15
i was feeling apprehensive and anxious was causing me even greater gt anxiety,fear,13
i went through a day of feeling like vegetables were boring,sadness,11
im feeling amazing,neutral,3
im feeling kinda lousy,sadness,4
i have done so in hopes of being inspiring while at the same time looking for solace from people rather than god and for proof that maybe i can do something good while i feel so horrible,sadness,37
i pray for our guests to feel welcomed and to receive whatever it is they need at that time whether that be a hug a word a prayer or just want to tell someone about their day,disgust,37
i feel very comfortable in the water when i dive,joy,10
im feeling just a tad apprehensive,fear,6
"Typing lab record at 2 AM, caffeine my only pal ☕",neutral,11
I never let her out of my sight; I never want her to think I'm ashamed of her.,sadness,18
i feel aggravated at the slow natural time line i stop working altogether and just procrastinate,anger,16
i dont mind for them talking but i dont feel that his intentions are innocent,joy,15
i do not want to worry about it i feel distracted,fear,11
i met a friend i had not seen for a long time on the street,joy,15
i can say how i feel without worry about a moronic comment made by some kid who knows nothing,fear,19
i have a good feeling the raiders will end up being the read more on a rel nofollow target blank href http sports,sadness,23
i feel distraught wondering why the fuck this is happening to me why do i have to see like a mirage of her every time i look in the mirror,anger,30
i can be angry and sit with it and feel it and not be scared of it,anger,17
i am feeling sad and alone,sadness,6
i feel hated alone and i feel like im a failure,disgust,11
i tag author note tag baekhyun tag baekyeol tag boy x boy tag chanyeol tag exo tag kris tag me tag my feels tag ouo tag shitty shit tag yaoi nov,sadness,31
i hate how you made me feel so unwelcome even after i drove miles to see you all because of the way that i look,disgust,25
i feel my beloved s pain a sharp instrument pressed through his skull his right eye,joy,16
i know many of these points feel angry and i hate feeling angry,anger,13
i was feeling amazing during the period of time that i was following this habit,joy,15
i was taking easy mac to work everyday which i hated because the thought of all that yellow dye and powdered cheese was making me feel dirty,disgust,27
i feel a friendly curiosity towards badgers whereas my sentiments concerning members of girls aloud tend towards undifferentiated loathing,fear,19
i felt even more ineffectual leading onto a larger anxiety and scary feelings of being intimidated even by the smallest seminar as all my confidence seemed to drain away,fear,29
brain’s all over the place lately. can’t lock in,anger,9
i feel it is my special connection to hashem during the day,joy,12
Iam having anxiety a bit I have exams coming iam scared about maths how I'll pass I scared still iam out today for shopping and sitting here iam thinking how I'll pass my math exam this sem.,fear,37
i feel like an ugly guy whos put on an ugly mask to cover his ugliness and now hes pissed because he found out the mask is ugly,sadness,28
i like taking cold showers i get out feeling invigorated and ready to roll,joy,14
I woke up feelin like something terrifyingly bad is gonna happen to me before I even got out of bed 😟,fear,21
wtfff is wrong with people?? still not over what i saw today.,anger,12
"I was just feeling everything, ya know? Mad, sad, dissapointed... or peaceful. Just everything.",disgust,14
i wrote about earlier it has something to do with the book feeling really rushed,anger,15
i did enjoy feeling as if all the others on the train were envious of me i concocted through their eyes a kind of fantasy about who i was and what i was up to,joy,35
Biology mnemonics fail: keep mixing xylem phloem. Considering 3D animation videos.,disgust,11
i feel reluctant to attend school again,fear,7
i have spent a lifetime trying to accurately express what i feel inside only to find out it is utterly hated and despised by the world,disgust,26
"Senior suggested iCall for anxiety, might try.",sadness,7
i was feeling more than a little apprehensive as i was traveling on an emergency issued passport kindly supplied by the british consulate in los angeles a week ago,fear,29
i cant do strappy shoes at work i just feel weird so i took these off thrifted ninewest,fear,18
i somehow feel hated,anger,4
i feel badly for being rude to this woman im unbelievably proud of myself for finally finally allowing myself a little bit of privacy on a matter which is no ones business,anger,32
finally got to chill with my fam today and it felt good in that “this is what matters” way 🫶,joy,20
"The all-night hackathon crash was supposed to be routine, but today it became the talk of the campus. At first, I was anxious, pacing back and forth in the corridor, then something clicked—maybe a bit of pumped mixed in—and I decided to just go with the flow. Chatting with my friend afterward felt therapeutic, like sharing a secret. Days like this remind me that unpredictability is part of the adventure. lol 😢",disgust,72
Extremely tensed for my results tomorrow hope it goes well,fear,10
i feel so irritable especially when i get asked to do things,anger,12
I feel so drained after staying up all night for the assignment.,sadness,12
im left feeling paranoid and like it keeps getting harder to feel happy,joy,13
i glance at you i feel more thankful than ever,joy,10
i looked into their eyes greeting them with ciao buongiorno and prego i offered a prayer of hope prayer that they would feel valued and cared for and in some small way a piece of dignity might be restored,joy,39
i feel like im the one whos hated,disgust,8
im tired of being stressed out all the time and im tired of making my friend feel stressed angry and guilty all of the time,anger,25
i suppose i might feel differently but even then i have my sincere doubts,joy,14
"Casual dating is fun till your relatives start sending you rishta profiles. I just wanted a summer fling, not a lecture on “settling down” 🥲",disgust,25
ive been feeling abit unhappy with myself,joy,7
Feelin very honored to be shortlisted for the patient ambassador volunteer category. Big deal! 🥳,joy,15
i get discouraged and feel defeated and think i have to do something to help him out,anger,17
i feel faintly outraged,anger,4
i am happy to say that after three years of writing i feel accepted,joy,14
i used to write words a day but i found with my ever increasing schedule i couldnt complete them every day and it left me feeling depressed,sadness,27
i feel more like myself when im with her rather than this is fearful little girl that hides in corners,fear,20
"Since I have very less friends, I have asked my sister to fill this form atleast 8-10 times a day, lmao. So that I can get good enough entries and train my model.",joy,33
i feel shaken broken down i feel angry i feel like i care when no one cares back not do u try to work things out to each its own is our new concept and model,anger,36
"Yo hi, I had cricket trials today and it was a total disaster. Ive been practicing daily for months but the wet ball just wouldnt obey, yaar. Felt so bad when the coach didnt even look at me. Teammate called me rusty, which stung more than the actual bad bowl. Sat alone in the locker room replaying everything, wondering if my wrist injury still bugs me or if Im just overthinking. Honestly, it sucked.",sadness,74
i didn t think that they were beasts but they didn t quite feel like my parents anymore and i hated that,disgust,22
"I still can’t believe the peaceful sit-in by seniors, totally had me delighted and exhausted. idk",fear,16
i think more people could benefit from feeling confident in their own tastes and their own choices without worrying about what other people think,fear,24
i want to drink and smoke and do drugs and eat meat and have caffine and shave my head just to feel like im doing something rebellious,anger,27
i feel more safe in my community now and i feel protected,joy,12
"Got dumped over a zoom call. The worst part? My WiFi cut out mid-breakup. I didn’t even get a proper closure, just a pixelated “it’s not you, it’s me” 💀",sadness,30
"Wrote mock letter to editor question thrice, handwriting still illegible; ICSE cares too much about cursive.",anger,16
i was hoping for in terms of getting to work on legislative issues and really feeling like a valuable and indispensable part of the team but its only been,joy,29
"got called into prof's office today, legit felt my soul leave my body 😨",fear,14
i am so glad my feelings matter so much to people that petty bullshit gets in the way of just cutting loose and having fun for a night and yes without alcohol or drugs,joy,34
im feeling a bit like mr furious in mystery men at the moment up to and including the largely ineffectual rage,anger,21
"I want to speak up, but the fear of being judged just locks my jaw.",fear,15
I have so much work to do but I can't get out of bed. I need to finish my report today so that I can begin the next one tomorrow.,fear,30
Spending weekends alone at home while most friends living on their own in other cities. Intense FOMO(Fear of missing out).,sadness,20
i feel hated and attacked by everyone a round me in fact by everyone in the world,disgust,17
Who knew the heatwave messing up schedules could make me feel this skeptical 😉. 😱,disgust,15
Reading about that crime was gut-wrenching. So much revulsion. 💔,disgust,10
"I never expected the surprise pizza party in the lounge to hit me this hard. One moment, I was casually scrolling, the next, I was curious, questioning every plan I had. Walking around the fest grounds, I saw seniors shaking their heads, juniors cheering, and I realized I was somewhere in between: confident. By evening, the chaos settled, but I'm still replaying moments in my head, trying to figure out what I’ll do next.",joy,74
i feel selfish when var disqus config function var config this access to the config object config,joy,17
i thought if this senior family in church leadership had raised good children they have stable jobs and stable families and they know this nice lady who comes to church sunday after sunday and feels helpless about all of her children who have not turned out that well,neutral,48
i am put in mind of an odd feeling of vicious cruel natural order here it seems no one is able to escape the town the cycles of predator and victim catching up with anyone trying to elevate themselves out of the mire,anger,43
i stay in bed worrying about something and cannot get to sleep because i feel stressed or if i feel i must remember to do something the next day i write that thing down,fear,34
I just feel ugly and hated. Sucks. 🙁,sadness,8
That group mate's attitude is nauseating. Library smelled awful near the ventilation vent.,disgust,13
Who knew the messy group project fallout could make me feel this delighted 😉. lol,anger,15
I feel bad for not accepting who I am. Why is that so hard? 😔,sadness,15
"Srsly, my headphones again?! Tangled instantlyyy. It's just the worst, such a painnnn all the time. 😠",anger,17
"My love life is a mess—there’s a literal love triangle, and everyone knows except the professors (thank God). Why can’t love be as chill as chai at college canteen? 😩",sadness,30
i am feeling depressed now,sadness,5
i feel so vulnerable to have a stranger have access to the bits of my life that are stored on that phone old emails texts pictures of lila,fear,28
i have learned to manage my anxiety and channel more positive outlets when i feel stressed such as exercise and music,fear,21
i always feel determined to complete them,joy,7
i feel the spirit supporting me in this and i dont worry as much as i might,fear,17
"I have spoken about before but the feeling is getting stronger and I am curious if others have similar thoughts. Whoa, is it just me?! 🧐",neutral,26
im speeding down a hill and i feel carefree and its like im floating,joy,14
i feel resentful about having to do the horses everyday with very little help and no company and dh is being a grumpy bugger,neutral,24
i feel like im being punished for existing,sadness,8
i feel perfectly content with my life one of those days i wish would happen more often,joy,17
i was thinking about marking down the dates where i feel particularly irritable upset or just sad to see if it is happening on a monthly basis,sadness,27
