text,emotion,text_len
i know the difference between feeling hurt and disappointed and angry,anger,11
"I watched an anime marathon today, and it was a rollercoaster. At first, I felt grossed out, then something unexpected made me repulsed. By the end, I was anxious and can't tell if I learned more or just got overwhelmed. 😡",disgust,41
i was feeling hopeful,joy,4
i try to push those sad feelings back with an insincere smile they seem to know and come rushing in to feed my insecurities,sadness,24
i feel like im just hated right now,disgust,8
i find myself feeling rather proud of tom daley for coming out today,joy,13
I thought maybe going on a run would help clear my head and honestly? It worked- not magic but it helped enough!!,joy,22
Why do people keep interrupting my study time? I'm so frustrated with this endless debugging!,anger,15
i feel like i have to always smile and always talk to someone i just want to not look ecstatic for one second without someone worrying about me,fear,28
"I’ve been feeling this heavy ache in my chest since I found out I failed that important midterm, and it’s like a constant reminder of my shortcomings. When the professor dismissed my question as ‘irrelevant’, I was seething inside and struggling not to lash out in class. I lie in bed at night replaying the argument with my roommate, the bitterness still lingers and keeps me up until dawn. I stare at the empty library seat where I was supposed to meet my study partner, and the silence echoes all my regrets. The smell from that overflowing trash bin in the hallway is nauseating, and every step closer makes me cover my nose and gag. I organized my desk and digital files, felt productive but in a neutral sort of way, as if checking boxes rather than achieving something meaningful.",sadness,140
i don t know why people forget once they were also fresher and please i am not at all interested in your attitude i am happy with mine i feel people are so selfish here nobody gives a damn about you they are like hathi ke daant dikhane ke or khaane ke or,joy,53
"Enjoyed a hilarious movie night with friends. Sunset view from the rooftop was breathtaking 😊 Got a message from my bestie, made my day.",joy,24
i feel helpless sad despair and can sometimes end up a big black hole of depression just thinking about all the suffering in the world,sadness,25
i feel optimistic for the first time in nearly twenty years,joy,11
"Im not quite sure how she really feels about it cuz Im pretty sure that she realizes that she is gonna miss gettin to watch the parade which is somethin she really enjoys. Bummer for her, but she loves that parade!",neutral,41
i feel very frantic and not sure what to do,fear,10
im feeling quite sad now but also happy that you to value the friendship,sadness,14
someone gifted me this book and it’s stunning but also? terrifying. like “am i smart enough to even attempt this??”,fear,20
i di and keep in mind to fear distrust and feel suspicious of mood alternation groundstrength dance regiment song downloadmiss her the love of two people everybody to them this is more difficult to be subjected to,fear,37
i would feel very ungrateful today if i didnt recognize the years ive been married to hubby,sadness,17
i just feel ashamed that i am even at this point,sadness,11
i could blog every day for the rest of my life about the depth of my love for my new family of three but it would still never be enough to explain how i really feel and i am so thankful,joy,41
i feel like an enraged fireman approaching a city,anger,9
"Couldn't solve that problem set, it's demotivating. Felt ignored during group discussion, was disheartening.",sadness,14
i hate this i feel helpless and like a total victim ive let stress take control,sadness,16
I just hate that I let myself get to this point. So much disappointment.,disgust,14
done yoga forever but this week? i’ve been so anxious i can’t even breathe right. what’s going on??,fear,18
im feeling very helpless and i think thats right where god wants me,fear,13
"PT sir announced half-marathon volunteers needed. Knee injury says no, heart says go.",fear,13
i find that i am having the same internal conversation debating the wisdom of sending a letter so long after his passing worrying about stirring up emotions and feelings that have been previously resolved and so on,fear,37
"Can't decide between B.Com and BBA, any legit difference?",neutral,9
i spent so long only worrying about getting that positive result that now that that i have it i feel overwhelmed at the inevitable changes my body will go through,fear,30
i am not totally happy with it feeling that is should have been crisper but i cant be bothered to have another go just yet,joy,25
"Just booked tickets for summer trip w besties! can't wait, literally counting down the days 🏖️😍",joy,16
Why did I do that? I'm just done with my own choices. 😖,disgust,13
"There’s something poetic about the campus-wide quiz contest finale happening on a rainy afternoon. I felt skeptical as raindrops tapped on the window, mirroring my heartbeat. Then I noticed a small group laughing about it—suddenly, I was exhausted, remembering that community makes these mishaps worth it. It’s wild how annoyed you can be and oddly grateful at the same time.",joy,60
Hostel surprise inspection drama; now too drained to revise Networks. Heard Pomodoro meetup at library may help.,fear,17
i had vaguely realized my health couldn t forever withstand the abuse i was heaping on it and many times when i thought of how unfair i was toward my wife i caught myself feeling remorseful,sadness,36
Just raged at a kfc worker for wrong order,anger,9
"Took a chill walk in nature today. Kinda tired afterwards, but totally recharged✨",joy,13
i walked out of the store feeling humiliated and invisible,sadness,10
i see myself as feeling valued and appreciated in this role and i want to feel like i am doing something worthwhile and important which is why a hospital environment with the nhs has attracted me,joy,36
i know what it feels like to be mad to have the screaming heebie jeebies,anger,15
"Early-morning mantra: read, revise, recall. Following Shwetabh sir’s three-hour Pomodoro block for polity chapters of UPSC prelim even though prelim next year. Helps boards too.",joy,25
"When I first heard about the guest lecture running an hour late, my mind raced: what if this ruins everything? But as it unfolded, I noticed everyone around me was irked, which gave me some comfort. By the time it ended, I was anxious and even cracked a small smile thinking about tomorrow's possibilities. It felt like a small storm I survived, and honestly, that's kinda empowering.",anger,67
i feel no feelings though i feel the aching hurt of our hearts the pit of sadness without an end i feel the tears stream and hit the pillow sending shock waves across the room,sadness,35
i have moments where i feel frantic,fear,7
Inorganic color cramming nightmare—thinking mnemonic videos before I lose it.,disgust,10
i feel surprised by how saddened i am,sadness,8
i had work from very much models and basic doodles that where the beginning stages of brain storming ideas which was a bit of a challenge that i feel i did well turning the idea and interpreting it in my own way and art style to fit in with the game and their work,joy,54
i can choose to feel annoyed and angry at someone,anger,10
i thank you all so much for your support whilst i didnt get into the top blogs i still feel very honoured to have been listed amongst some of the most influential voices on the blogosphere,joy,36
i feel disgusted c kj posted by a class url fn n href http lanapolj,anger,15
"Just waitin' for that one person to reply in the group chat, and it's takin' f-o-r-e-v-e-r. I'm just sooo on edge.",anger,21
i hate how good i feel about using behaviors in the moment and then i am regretful later,disgust,18
i don t feel quite so outraged about things any more,anger,11
"Did yoga at sunrise after a bad nights sleep, dragging my mat out felt like punishment. Once I started moving, my mind just stopped. For a few minutes, wasnt worried about exams, placements, or what coach thinks. Downward dog, warrior two, and suddenly, everything was chill. Why dont I do this more often? Maybe its the only time Im okay with just being.",joy,63
i usually feel dirty from traveling when im back home but this time i felt dirty from the city,sadness,19
i love the comraderie at work but when so many people are feeling defeated it is hard to not let it get to you,sadness,24
i feel very triumphant another personal mini goal accomplished,joy,9
I messed up my presentation and I can't stop replaying it.,sadness,11
"Swimming at the local pool, not a great swimmer but trying for my knee. Got lapped by juniors, which kinda sucked. But floating on your back, staring at the sky, no thoughts, just calming.",neutral,34
"Poetry slam win was ecstatic, my freedom piece resonated. Poet , crowd loved it.",joy,14
im feeling dangerous riding on city buses for a hobby is sad why dont you lead me to a living end i promised that id entertain my crippled friend my crippled friend,sadness,32
i do feel discouraged,anger,4
i feel like perhaps i ought to be offended,anger,9
"Basketball camp is brutal. Coach K makes us do suicides, free throws, push ups back to back. Got elbowed in the face during a rebound drill, no foul call, walked off with a fat lip. On the bright side, my verticals improved a bit. Still cant dunk but maybe I wont get blocked every time now.",anger,56
i feel very remorseful because few months back i was angry at him for abusing my cats and being rude to me,anger,22
i klum at the victoria s secret fashion show i feel very energetic,joy,13
im feeling paranoid about doing well,fear,6
i want to feel glamorous when i m cooking tacos nicole says,joy,12
"Got a surprise treat from my roommate, sweet gesture. Sunset view from the rooftop was breathtaking 😊 Discovered a new coffee place near campus, love it.",joy,26
i feel very selfish because the reasons are my own,anger,10
i encountered some real barriers and i am feeling a lot more sympathetic to the concerns that i have heard fellow vegetarian parents express over the years,fear,27
"wanna take a shower again, it's too humid in here",disgust,10
i don t like the feeling of regret i hated it,disgust,11
"Night-owl physics squad session: Arjun, Zoya, me on Discord racing HC Verma questions. Ended with Badri-ke-Dulhania karaoke at 2 a.m. Stress but fun.",joy,23
i believe that everyone will feel this way at one point or another in their lifetime to feel tortured because of our inability to take control of a certain situation to feel stuck in one place while life passes us by,anger,41
"It's rough, the new intern's gettin' all the flak. It's so wronggg, and I'm just seeeethin' with anger for 'em. 🤬",anger,21
i mean is that it showed me god knew me and as much as i had been feeling shaky in my faith and life direction he was there,fear,28
i always wondered if my preference for sharing my thoughts and feelings with mom bothered my dad if he really did feel left out or if he just chalked it up to some sort of mother daughter connection,anger,38
"Had a really good chat with an old friend. Felt super connected and just this calm, chill joy from it. 😊",joy,21
That artwork is just tacky. No real appeal. 😒,disgust,9
i can t help but feel hopeful,joy,7
I just felt very busy.,neutral,5
"Spaced-repetition schedule for 10th board history done: every Mughal emperor gets flashcard, review gaps shrink from five days to one. Hoping it sticks.",joy,23
Can't step into a shop anywhere without getting super uncomfortable.,fear,10
i thought it was worth mentioning because the steubenville trial was and still is something i feel very strongly about and i have always always hated the deification of sports students within their educational facilities and their sheer arrogance coupled with their animalistic top lad culture,disgust,46
i have been around people nonstop i start feeling drained and find myself pulling away,sadness,15
i don t want to be overlooked in no way shape or form when it comes to street hip hop or any accolades that i feel are given to any artists that speak of this type of content,joy,38
i know its not real but i still feel shaken,fear,10
i am feeling quite discouraged at the moment,anger,8
"Spent the afternoon gaming, now I'm elated",joy,7
i like to sit on the couch doing nothing for hours i m not always left feeling content doing it unless i m sick,joy,24
"I didnt feel pressured or limited, just felt super busy, low-key kinda scary how busy",fear,15
i want to ride around without one i should not feel threatened by click it or ticket laws,fear,18
i would feel terrible if i did do it,sadness,9
i guess this sense of attachment i feel to pets and the assumption that they are somehow little people rather than not particularly intelligent bundles of fluff is what makes them good companions and nice things to have around,joy,39
Missing home and feeling lonely in this hostel.,sadness,8
i are each substituting one green drank in for a meal for the rest of this week because we really feel we need to detox after all the delicious holiday food,neutral,31
The way Roy brags about everything is seriously off-putting. 🤢,disgust,10
"Just saw some dude spit gum right on the sidewalk, like who raised you man? Respect your environment, disgusting fr 🤮",disgust,21
i was so angry with a patient who refused to take drugs,anger,12
i hate feeling dumb i hate people who make me feel dumb or like i am being a baby,disgust,19
i feel shaky in such a happy way,joy,8
i encountered some obstacles in the first couple of weeks that left me feeling confused discouraged completely alone and a host of other negative emotions that did everything they could to hinder my work,fear,34
i have feeling i can cry i can scream i can be afraid,fear,13
im feeling a little humiliated when really maybe i shouldnt,sadness,10
"There’s a hollow feeling whenever I walk past my friends chatting without me, and I catch myself replaying every word I said in my head, wondering where I went wrong. The thought that I might lose all my work in a system crash gave me cold sweats and made me question why I hadn’t backed up earlier. Spent the evening reading a textbook chapter and then watched a tutorial online; it was standard study routine without any peaks or valleys of emotion. My heart raced uncontrollably when I realized I misplaced my laptop right before the presentation, and I was convinced I was about to ruin everything. Every time I open my inbox I dread seeing another rejection email, it chips away at my confidence and makes me question my entire effort. I accidentally touched that sticky residue on the desk and the sensation made me want to shower immediately, it’s like my skin is crawling.",sadness,156
kinda scared tbh about work n all but also mad mad... like angry at myself too- i just continue to disappoint myself everytime,fear,23
"Regular volunteer shift at old age home, stories shared. Volunteer , fulfilling yet routine.",neutral,14
i feel like i might hate him even more than i hated his brother,disgust,14
Furious that the internet died mid-upload!,anger,6
legit afraid I'm picking the wrong major. what if I regret this later? 😰,fear,14
I feel fine now even though Ive just burned the dinner oops. Still good tho! 😂,joy,16
I’m feeling unsatisfied as I have a lot on my plate but I haven’t started to do anything.,fear,18
i feel it is my sweet room,joy,7
Many situations today made me realize that I am actually quite indecisive.,disgust,12
ive had some nervousness i feel confident about the content and lok forward to it,joy,15
i heard about it i feel so so proud of him because he bought it with his hard earned money,joy,20
i mean is if a woman is walking alone at night cross the road and walk on the other side of the street so she doesn t feel threatened by you,fear,31
i feel like it is almost vital that if i do not find more answers about a href http credit card info u,joy,23
"Today’s sunset on the campus lake was so vivid it looked painted, and for a moment all my stress melted away as I soaked in the colors. Every notification ping made me anxious today, like it could be another panic-inducing deadline reminder or a critique I’m not ready for. I stare at the empty library seat where I was supposed to meet my study partner, and the silence echoes all my regrets. The thought that I might lose all my work in a system crash gave me cold sweats and made me question why I hadn’t backed up earlier. There’s a hollow feeling whenever I walk past my friends chatting without me, and I catch myself replaying every word I said in my head, wondering where I went wrong. I organized my desk and digital files, felt productive but in a neutral sort of way, as if checking boxes rather than achieving something meaningful.",fear,154
i was sitting at the table eating my food feeling blank and staring off into space worrying about all my uncertainties and the loss of happiness that might be waiting for me just around the corner i started craving sedation,fear,40
CAT mock percentile crash (83 to61). Subscribing to 2IIM test series & weekend analytics workshop for comeback.,disgust,17
i get scared i feel ignored i feel happy i get silly i choke on my own words i make wishes i have dreams and i still want to believe anything can happen in this world for an ordinary girl a class profile link href http www,joy,47
"Winning the essay contest in lit society brought jubilation. Writer , arguments on point.",joy,14
i thought at least i would feel awkward and uncomfortable,sadness,10
i feel somewhat hateful towards it,disgust,6
i didnt feel sad that they were single because being single is a gift that sometimes if im honest with you i envy,sadness,23
i feel like i did something horrible,sadness,7
"As sports secretary, the rain canceled our inter-hostel cricket match today after all the prep, and I'm furious at the weather and the committee for not having a backup plan. , this was supposed to be big, but now the team's morale is low, and I regret not pushing for an indoor option.",anger,53
im tired of feeling like this all hopeless and sad all the time but on the other hand im kinda stuck,sadness,21
i should be feeling happy instead but why am i feeling frustrated,joy,12
i feel that it s time on my mac blog to completely destroy the idea that apple is a company to be hated,disgust,23
i do feel that he should be punished but it should be understood that punishing him in whatever way is not going to solve the greater problem of terrorism,disgust,29
i feel so beaten down by it this fear of breathlessness and i am tired and i just want to spend a few hours telling my self that it s all okay and not that bad and what were we worrying about anyway even if that might involve some lying so,fear,51
They talked trash about my roots. That's just not cool. That's a l-i-n-e,anger,13
i loved it although it left me feeling rather melancholy,sadness,10
i am on sunday night working on a presentation for monday and i feel resentful and angry,anger,17
i am feeling rather overwhelmed with all that is on my to do list,fear,14
i never felt as if god was angry with me instead i confessed my feelings to him he assured me that he values the choices that ive made and will continue to honor me for all those chances i chose not to make out with any guy no matter how seemingly genuine they were,anger,54
"Spent time organizing my notes, nothing eventful.",neutral,7
"There’s something poetic about the peaceful sit-in by seniors happening on a rainy afternoon. I felt thrilled as raindrops tapped on the window, mirroring my heartbeat. Then I noticed a small group laughing about it—suddenly, I was anxious, remembering that community makes these mishaps worth it. It’s wild how annoyed you can be and oddly grateful at the same time.",fear,60
i feel like i am depressed,sadness,6
i don t know maybe it s just me but when i cram i feel more stressed and i don t perform as well in the exam because i m too busy worrying about what i ve just learnt,fear,39
i feel cool when i say i m haitian despite all the problems it has why would we encourage him to do anything else but promote the wonderful things about this country along with a constant push for the betterment of it and its people,anger,45
i woke up this morning feeling melancholy and a bit out of sorts,sadness,13
Angry at the constant noise from the construction site. I'm so frustrated with this endless debugging!,anger,16
Why does organic chem smell like failure 😩,neutral,8
been kinda rebellious lately. not even in a cool way just... defiant. like don’t tell me what to do i’ll do the opposite lol,anger,24
i feel them gnawing out holes through flawless souls,joy,9
i feel so tortured because someone means so much to me and i cant be with them,anger,17
im just delaying the facts that should be expressed i m feeling too shy in a way to confirm it,fear,20
i feel abused every where i go with everyone i am sad and lonely,sadness,14
i got it all out every last negative feeling and thought and looked at him sitting there looking loving and concerned,fear,21
im so happy about this as he was really looking feeling awful,sadness,12
i get a bit jealous about the funding that regional areas get i live very close to the city but feel distinctly disadvantaged when it comes to these things,sadness,29
i am feeling the most horrible mix of anticipation and anxiety and apprehension,fear,13
i encourage you to take one small action toward addressing something you feel dissatisfied with,anger,15
i have a great hospitality manager and she is awesome at making new members feel welcomed and attending events each week,joy,21
Evening reflection: CGPA slipped to 6.2 after injury. Corridor echoed with 9-pointer screams while I faked smiles. Counsellor suggested peer-support meet every Friday in Seminar Hall 3—gonna try.,sadness,28
"College festival prep eating up study hours, priorities messed up.",anger,10
i feel really passionate about because i find it really sad how the british high street is falling and how difficult it is for local businesses to survive in the current climate,sadness,32
"Gonna meet my school friends today, finally. Been ages, need some good old nostalgia.",joy,14
i was beginning to feel aggravated by the total lack of confirmation i was getting either way,anger,17
"Spent evening teaching junior integration, felt good 🙂",joy,8
i kept my feelings to myself and even defended you to some of my other children who hated you and what you stood for to them,disgust,26
"Backbench whispers turned into full blown argument with lecturer, awkward.",anger,10
i cant help but feel kinda not confident with his diagnosis prognosis whatever its called,disgust,15
i am now feeling more and more confident and with little improvements here and there i know i can be fighting for a top in most races and a spot in the money if i stay the course,joy,38
"Finally made the college volleyball team after months of begging and extra drills. First match got rained out classic monsoon. Still, seeing my name on the team sheet gave me a real boost. For once, feel like Im part of something bigger, not just alone in my room. Packed my kit, sat there staring at the knee pads, actually felt kinda proud.",joy,62
im feeling dreadfully homesick much to my suprise and i feel i cant talk to anyone about ergo i shall unload my problems on to you anonymous reader,sadness,28
i feel like an unwelcome visitor in my own body and my new place doesnt feel like home yet despite the heroic efforts of my amazing friends and countless trips to ikea,sadness,32
i am still not feeling well,joy,6
im trying my best to tweet and retweet to connect sudan to the world and spread awareness but i feel really sad that im not there,sadness,26
i am afraid of what i feel but do not know how to face that fear i am doubtful about why lies ahead but do not want to be found dead so i sit wondering what is next where will this madness take me,fear,44
i feel like my brain is going to leak out of my ears pretty soon,joy,15
i feel discouraged and exhausted,anger,5
i still feel funny every time someone looks at me like i m the next best thing since merlin said leo it s like they expect more from me than what i have,joy,33
"I feel validated because I was the first person to enter my study space, not even the cleaners are here yet. Also, I am stressed as well because there are assignment deadlines, job uncertainty. But I am trying to keep a positive outlook.",fear,43
i dislike meeting my relatives amp getting questions i feel theyre just curious about and not concern,fear,17
Just got my paycheck extremely happy,joy,6
i decide i feel rich or hate dover or both,disgust,10
i cannot even begin to worry about how ugly and gross they look because they feel awful and make it hard to function,fear,23
"Wish I could just snap out of it and simply feel, live, laugh, enjoy life, no matter how stupid it is. If only it were that easy. 😩",sadness,28
i am not a germaphobe but for some reason i feel like it is so dirty up in there,sadness,19
i feel relaxed but sadly have no bird sound,sadness,9
